id,name,model_id:id,group_id:id,perm_read,perm_write,perm_create,perm_unlink
access_software_tag_user,Read and write access to software tag for User,model_software_tag,software.group_software_user,1,0,0,0
access_software_tag_manager,Full access to software tag for Manager,model_software_tag,software.group_software_manager,1,1,1,1
access_software_application_user,Read and write access to software application for User,model_software_application,software.group_software_user,1,1,0,0
access_software_application_manager,Full access to software application for Manager,model_software_application,software.group_software_manager,1,1,1,1
access_software_application_release_user,Read and write access to software application release for User,model_software_application_release,software.group_software_user,1,1,0,0
access_software_application_release_manager,Full access to software release for Manager,model_software_application_release,software.group_software_manager,1,1,1,1